{
  "team_id": "team_0",
  "scenario_id": "T0-P01",
  "production_plan": [
    {"week": 1, "product_id": "FG01", "quantity": 950, "line_id": "L1", "overtime_hours": 0},
    {"week": 1, "product_id": "FG02", "quantity": 762.5, "line_id": "L1", "overtime_hours": 0},
    {"week": 1, "product_id": "FG03", "quantity": 570, "line_id": "L2", "overtime_hours": 0},
    {"week": 2, "product_id": "FG01", "quantity": 950, "line_id": "L1", "overtime_hours": 0},
    {"week": 2, "product_id": "FG02", "quantity": 762.5, "line_id": "L1", "overtime_hours": 0},
    {"week": 2, "product_id": "FG03", "quantity": 570, "line_id": "L2", "overtime_hours": 0},
    {"week": 3, "product_id": "FG01", "quantity": 950, "line_id": "L1", "overtime_hours": 0},
    {"week": 3, "product_id": "FG02", "quantity": 762.5, "line_id": "L1", "overtime_hours": 0},
    {"week": 3, "product_id": "FG03", "quantity": 570, "line_id": "L2", "overtime_hours": 0},
    {"week": 4, "product_id": "FG01", "quantity": 950, "line_id": "L1", "overtime_hours": 0},
    {"week": 4, "product_id": "FG02", "quantity": 762.5, "line_id": "L1", "overtime_hours": 0},
    {"week": 4, "product_id": "FG03", "quantity": 570, "line_id": "L2", "overtime_hours": 0}
  ],
  "purchase_orders": [
    {"material_id": "RM01", "supplier_id": "SUP01", "quantity": 2500, "order_day": 7, "expedite": false},
    {"material_id": "RM01", "supplier_id": "SUP01", "quantity": 2500, "order_day": 14, "expedite": false},
    {"material_id": "RM02", "supplier_id": "SUP01", "quantity": 1200, "order_day": 15, "expedite": false},
    {"material_id": "RM05", "supplier_id": "SUP03", "quantity": 2500, "order_day": 19, "expedite": false},
    {"material_id": "RM06", "supplier_id": "SUP03", "quantity": 2000, "order_day": 12, "expedite": false},
    {"material_id": "RM06", "supplier_id": "SUP03", "quantity": 2000, "order_day": 19, "expedite": false}
  ],
  "actions": [
    {
      "action_type": "use_existing_purchase_orders",
      "reason": "Existing RM03 and RM05 purchase orders are included before creating new orders.",
      "requires_approval": false
    },
    {
      "action_type": "stagger_purchases",
      "reason": "Receipts are timed near need dates to reduce carrying cost while preserving service.",
      "requires_approval": false
    }
  ],
  "assumptions": ["Normal supplier performance under scenario T0-P01."],
  "explanation": "Worked reference plan for the fully solved Case 0."
}
